{
  "z1a": [
    "##############################",
    "#............................#",
    "#............................#",
    "#...##..................##...#",
    "#...##..................##...#",
    "#............................#",
    "#............................#",
    "#.........######.............#",
    "#.........######.............#",
    "#............................#",
    "#............................#",
    "#...##..................##...#",
    "#...##..................##...#",
    "#............................#",
    "#............................#",
    "#............................#",
    "##############################"
  ],
  "z1b": [
    "##############################",
    "#............................#",
    "#............................#",
    "#....####.........####.......#",
    "#....####.........####.......#",
    "#............................#",
    "#............................#",
    "#######...........############",
    "#............................#",
    "#............................#",
    "############........##########",
    "#............................#",
    "#............................#",
    "#....####.........####.......#",
    "#....####.........####.......#",
    "#............................#",
    "##############################"
  ],
  "z2a": [
    "##############################",
    "#............................#",
    "#..##....................##..#",
    "#..##.....##########.....##..#",
    "#........#........#..........#",
    "#........#........#..........#",
    "#........#........#..........#",
    "#........#........#..........#",
    "#........##########..........#",
    "#............................#",
    "#............................#",
    "#..##....................##..#",
    "#..##....................##..#",
    "#............................#",
    "#............................#",
    "#............................#",
    "##############################"
  ],
  "z2b": [
    "##############################",
    "#............................#",
    "#............................#",
    "#...###..............###.....#",
    "#...###..............###.....#",
    "#............................#",
    "#.......####....####.........#",
    "#............................#",
    "#............................#",
    "#.......####....####.........#",
    "#............................#",
    "#...###..............###.....#",
    "#...###..............###.....#",
    "#............................#",
    "#............................#",
    "#............................#",
    "##############################"
  ],
  "z3a": [
    "##############################",
    "#............................#",
    "#............................#",
    "#......#..............#......#",
    "#......#..............#......#",
    "#......#....####......#......#",
    "#............####............#",
    "#............................#",
    "#............####............#",
    "#......#....####......#......#",
    "#......#..............#......#",
    "#......#..............#......#",
    "#............................#",
    "#............................#",
    "#............................#",
    "#............................#",
    "##############################"
  ],
  "z4a": [
    "##############################",
    "#............................#",
    "#............................#",
    "#.....##..............##.....#",
    "#.....##..............##.....#",
    "#............................#",
    "#..........#......#..........#",
    "#..........#......#..........#",
    "#..........#......#..........#",
    "#..........#......#..........#",
    "#..........#......#..........#",
    "#............................#",
    "#.....##..............##.....#",
    "#.....##..............##.....#",
    "#............................#",
    "#............................#",
    "##############################"
  ],
  "z4b": [
    "##############################",
    "#............................#",
    "#............................#",
    "#...####..........####.......#",
    "#............................#",
    "#............................#",
    "######......######......######",
    "#............................#",
    "#............................#",
    "#............................#",
    "######......######......######",
    "#............................#",
    "#............................#",
    "#...####..........####.......#",
    "#............................#",
    "#............................#",
    "##############################"
  ],
  "boss": [
    "##############################",
    "#............................#",
    "#............................#",
    "#............................#",
    "#..###..................###..#",
    "#..###..................###..#",
    "#............................#",
    "#............................#",
    "#............................#",
    "#............................#",
    "#............................#",
    "#..###..................###..#",
    "#..###..................###..#",
    "#............................#",
    "#............................#",
    "#............................#",
    "##############################"
  ]
}
